Project Name,Description
Advanced Framework,"Telecommunications network planning and capacity optimization for growth. Traffic forecasting and demand modeling informing infrastructure investments. Network slicing and optimization for different service types and customers. Cost-effective capacity expansion ensuring performance at lowest cost. Reduced network congestion and improved customer experience."
Strategic Solutions,"Financial planning and analysis modernization enabling faster, more accurate forecasts. Automated data collection from multiple sources consolidating financial information. AI-powered forecasting improving accuracy over manual processes. Scenario modeling enabling rapid evaluation of strategic options. Faster close processes and better financial decision-making."
Digital Analytics,"Retail customer behavior analysis using computer vision and foot traffic tracking. Real-time heat maps revealing high-traffic areas and customer flow patterns. Effectiveness analysis of displays and promotions based on engagement. Store layout optimization improving merchandising and sales. Sales uplift of 10-20% through data-driven store operations."
Global Gateway,"Supply chain resilience and dual-sourcing strategy reducing single-source risks. Supplier diversification across geographies and capabilities. Risk monitoring and early warning systems alerting to potential disruptions. Contingency planning and response protocols for rapid recovery. Reduced supply chain disruptions and business continuity."
Smart Platform,"Energy grid modernization and smart meter deployment enabling demand response. Real-time consumption monitoring enabling customer engagement in conservation. Predictive analytics optimizing grid operations and reducing losses. Integration of renewable energy sources and distributed generation. Improved grid efficiency and sustainability while reducing operational costs."
Unified Solutions,"Pharmaceutical marketing compliance and regulatory documentation management. Automated document assembly and version control ensuring compliance. Review workflow ensuring appropriate approvals and documentation. Audit trails supporting regulatory examinations. Reduced compliance risk and faster product launch timelines."
Enterprise Hub,"Manufacturing supply chain digitalization enabling end-to-end visibility. Supplier integration portals enabling real-time order and shipment tracking. Quality and compliance documentation ensuring traceability. Predictive analytics preventing shortages and optimizing inventory. Improved on-time delivery and reduced supply chain costs."
Integrated Platform,"Healthcare revenue cycle optimization reducing billing delays and denials. Automated eligibility verification before service delivery. Claims optimization and follow-up processes reducing rejections. Predictive analytics identifying payment risks early. Revenue improvements of 8-12% through improved collections."
Cloud Analytics,"Retail sustainability and ESG reporting platform tracking environmental impact. Emissions tracking across operations and supply chain. Waste reduction metrics and circular economy initiatives. Supplier sustainability requirements and compliance monitoring. Stakeholder reporting supporting ESG commitments and investor relations."
Secure Solutions,"Financial cybersecurity and fraud prevention across payment systems. Real-time transaction monitoring detecting fraudulent patterns. Biometric authentication enabling secure customer access. Encryption and secure key management protecting sensitive data. Reduced fraud losses and improved customer confidence."
Quantum Engine,"Insurance policy administration modernization improving customer experience. Self-service portals enabling policy updates and inquiries. Automated policy issuance and renewal processes. Integration with distribution channels for seamless experiences. Reduced operational costs and improved customer retention."
Nexus Solutions,"Entertainment venue ticketing and management platform maximizing revenue. Dynamic pricing optimizing prices based on demand and inventory. Revenue management strategies across event categories and time. Ancillary revenue from food, beverage, and merchandise. Revenue per attendee improvements of 20-30%."
Vertex Services,"Telecommunications IoT connectivity platform enabling smart city and enterprise applications. Dedicated IoT network optimized for low power and wide area coverage. Device management and provisioning at scale. Edge computing enabling real-time processing and reduced latency. New business opportunities in IoT and connected services."
Apex Framework,"Retail return and refund management improving operational efficiency. Automated return authorization and processing. Resale or recycling of returned items maximizing recovery value. Fraud detection preventing return abuse and losses. Return processing cost reductions of 25% improving profitability."
Summit Analytics,"Sports analytics platform providing performance insights and player development guidance. Wearable device integration capturing biomechanical and physiological data. Computer vision analysis of game footage and techniques. Predictive injury risk identification enabling prevention. Competitive advantage through data-driven training and tactics."
Advanced Gateway,"Construction safety and incident management reducing workplace injuries. Wearable devices monitoring worker safety and fatigue. Real-time hazard detection and safety alerts. Incident documentation and root cause analysis. Safety culture improvement reducing accident rates by 40%."
Strategic Hub,"Financial derivatives and risk management platform for hedging. Automated pricing models ensuring fair valuation. Real-time risk monitoring across positions and portfolios. Scenario analysis and stress testing. Improved risk management and profitability."
Digital Services,"Telecommunications infrastructure sharing enabling faster network deployment. Open access to cell towers and fiber assets. Automated provisioning and revenue sharing. Cost reduction through shared infrastructure. Accelerated 5G and fiber deployment."
Global Platform,"Automotive connected vehicle platform enabling OTA updates and remote diagnostics. Vehicle data collection and analytics improving products. Predictive maintenance preventing breakdowns. Customer engagement through in-vehicle services. New revenue streams from connected services."
Smart Engine,"Hospital resource allocation and bed management optimization. Real-time bed availability and patient flow visibility. Predictive analytics preventing bottlenecks. Automated bed assignment improving efficiency. Patient throughput improvements and reduced wait times."
Unified Framework,"Financial market surveillance and regulatory compliance for trading operations. Real-time trade monitoring detecting suspicious activities. Automated alerts and escalation procedures. Regulatory reporting and audit trail documentation. Compliance with market conduct regulations."
Enterprise Solutions,"Manufacturing predictive analytics and condition-based maintenance. Real-time equipment monitoring and health assessment. Predictive failure models preventing unplanned downtime. Maintenance optimization and spare parts planning. Equipment availability improvements reducing production losses."
Integrated Analytics,"Healthcare patient journey mapping improving care coordination and outcomes. Integrated view of patient interactions across care settings. Care plan tracking ensuring protocol adherence. Outcome measurement and quality improvement. Improved patient satisfaction and reduced readmissions."
Cloud Gateway,"Retail demand planning and replenishment optimization reducing waste. Inventory forecasting accuracy improvements. Automated replenishment ensuring stock availability. Seasonal and promotional planning integration. Inventory reduction of 15% while improving service levels."
Secure Analytics,"Insurance cyber risk assessment and mitigation guidance. Vulnerability scanning and threat modeling. Risk quantification and ROI analysis of controls. Remediation roadmap prioritization. Risk reduction and improved insurance underwriting."
Quantum Solutions,"Financial transaction settlement and clearing modernization. Blockchain-based settlement enabling instant finality. Reduced settlement risk and operational costs. Real-time settlement reducing counterparty risk. Market infrastructure transformation."
Nexus Platform,"Entertainment creator economy platform enabling content monetization. Direct fan support and patronage mechanisms. Merchandise and NFT integration. Revenue sharing and payout automation. Creator community growth and earnings."
Vertex Framework,"Telecommunications customer experience management across channels. Omnichannel interaction tracking and history. AI-powered customer service routing and resolution. Satisfaction tracking and improvement. Customer experience scores improving by 30%."
Apex Platform,"Legal case management and litigation support automation. Document management and e-discovery efficiency. Litigation cost tracking and matter profitability. Predictive analytics on case outcomes. Improved profitability and faster case resolution."
Summit Gateway,"Sports player trading and transfer market optimization. Player valuation and market trend analysis. Contract negotiation support and management. Team performance impact modeling. Strategic player acquisition improving competitiveness."
Advanced Analytics,"Construction equipment utilization and cost management. Asset tracking and scheduling optimization. Maintenance tracking and predictive servicing. Utilization rate improvements reducing costs. Equipment ROI optimization."
Strategic Framework,"Pharmaceutical supply chain serialization and tracking. Track-and-trace for regulatory compliance. Counterfeit prevention throughout distribution. Rapid recall capability if needed. Supply chain integrity and patient safety."
Digital Solutions,"Telecommunications network security and threat prevention. DDoS mitigation and traffic filtering. Malware detection and prevention. Security incident response automation. Improved network security and uptime."
Global Analytics,"Automotive recall management and customer notification. Rapid deployment of over-the-air fixes. Service scheduling and parts management. Customer communication throughout recall. Quality and reputation protection."
Smart Hub,"Hospital emergency department optimization. Triage algorithm improvements reducing wait times. Bed capacity management and throughput. Discharge planning and follow-up coordination. Emergency care efficiency and safety."
Unified Engine,"Financial compliance and regulatory reporting automation. Regulatory requirement change tracking. Automated report generation and submission. Audit preparation and documentation. Compliance cost reduction and risk mitigation."
Enterprise Platform,"Manufacturing quality assurance and statistical process control. Real-time quality monitoring and alerts. Root cause analysis of defects. Continuous improvement tracking. Quality improvements and waste reduction."
Integrated Hub,"Healthcare medical records interoperability and exchange. Standards-based EHR data sharing. Privacy controls and patient consent management. Clinical decision support integration. Improved care coordination and outcomes."
Cloud Services,"Retail omnichannel fulfillment and logistics optimization. Order routing across channels and locations. Last-mile delivery optimization. Returns processing and reverse logistics. Fulfillment cost reduction and delivery speed."
Secure Framework,"Insurance claims investigations and fraud detection support. Digital evidence collection and management. Case management and workflow automation. Investigation outcome tracking. Fraud loss reduction and claims accuracy."
Quantum Analytics,"Financial portfolio optimization and risk management. Asset allocation recommendations. Risk analysis and stress testing. Rebalancing automation and execution. Improved returns and risk-adjusted performance."
Nexus Services,"Entertainment content distribution and streaming optimization. Multi-region content delivery. Bitrate adaptation for network conditions. Analytics on viewer engagement and churn. Improved streaming experience and retention."
Vertex Analytics,"Telecommunications tower location optimization for coverage. Geographic coverage analysis and modeling. Capacity planning based on traffic patterns. Network performance optimization. Coverage gaps elimination and investment prioritization."
Apex Engine,"Legal document review and due diligence automation. AI-powered document classification and extraction. Concept-based searching across large document sets. Privilege log generation. Due diligence cost and timeline reduction."
Summit Services,"Sports athlete sponsorship matching and contract management. Brand-athlete fit analysis. Contract term negotiation support. Performance tracking and fulfillment. Sponsorship ROI optimization."
Advanced Solutions,"Construction project cost management and forecasting. Budget tracking and variance analysis. Change order management and approval workflow. Earned value tracking. Cost overrun prevention and profitability."
Strategic Analytics,"Pharmaceutical regulatory affairs and compliance management. Regulatory requirement tracking and interpretation. Submission document assembly and tracking. Regulatory correspondence management. Faster approvals and reduced costs."
Digital Framework,"Telecommunications inventory management and optimization. Network equipment tracking and utilization. Spare parts inventory optimization. Procurement efficiency. Inventory carrying cost reduction."
Global Services,"Automotive supply chain visibility and risk management. Supplier location and alternative sourcing. Supply disruption prediction and mitigation. Cost optimization through sourcing. Supply chain resilience."
Smart Solutions,"Hospital staff scheduling and workforce management. Shift scheduling optimization across units. Staffing level targeting. Time tracking and labor law compliance. Labor cost control and service continuity."
Unified Analytics,"Financial trade execution and market microstructure optimization. Execution algorithm selection and routing. Market impact minimization. Cost analysis and benchmarking. Improved trade execution and cost reduction."
Enterprise Framework,"Manufacturing asset maintenance and reliability engineering. Maintenance work order management. Spare parts inventory and procurement. Downtime tracking and root cause analysis. Asset reliability and availability improvements."
Integrated Services,"Healthcare appointment scheduling and patient flow optimization. Availability management and overbooking prevention. Patient reminder systems reducing no-shows. Cancellation and slot utilization optimization. Patient access and revenue cycle optimization."
Cloud Analytics,"Retail shrinkage and loss prevention optimization. Theft pattern detection and prevention. Employee integrity monitoring. Vendor fraud prevention. Shrinkage reduction of 30% improving profitability."
Secure Solutions,"Insurance policy underwriting and rating optimization. Application processing automation. Risk assessment algorithms. Automated rating and approval. Underwriting efficiency and volume growth."
Quantum Services,"Financial data management and master data governance. Data quality assurance and remediation. Data lineage and impact analysis. Regulatory data requirements compliance. Data integrity and operational efficiency."
Nexus Analytics,"Entertainment box office prediction and movie analytics. Box office forecasting models. Audience preference analysis. Marketing effectiveness tracking. Investment and distribution optimization."
Vertex Hub,"Telecommunications customer data and profile management. Customer single view across touchpoints. Privacy and consent management. Data enrichment and validation. Improved customer insights and marketing."
Apex Services,"Legal contract lifecycle management and automation. Contract authoring and assembly. Obligation tracking and management. Renewal and expiration tracking. Contract compliance and cost management."
Summit Framework,"Sports performance analytics and team strategy optimization. Player statistics and tracking. Opponent analysis and scouting. Game strategy modeling and simulation. Competitive advantage through analytics."
Advanced Services,"Construction equipment and asset predictive maintenance. Equipment sensor data monitoring. Failure prediction models. Preventive maintenance scheduling. Unplanned downtime reduction by 40%."
Strategic Services,"Pharmaceutical clinical supply chain and manufacturing. Demand forecasting for clinical trials. Manufacturing scheduling optimization. Storage and stability management. Supply assurance and trial continuity."
Digital Hub,"Telecommunications customer retention and win-back programs. Churn propensity modeling. Retention offer personalization. Win-back campaign targeting. Reduced churn and improved customer lifetime value."
Global Hub,"Automotive inventory management and dealer optimization. Vehicle allocation across dealerships. Demand forecasting and production planning. Pricing optimization by market and timing. Inventory turnover and margin improvement."
Smart Framework,"Hospital patient safety and adverse event reporting. Safety event documentation and tracking. Trending and analysis of safety issues. Corrective action tracking. Culture of safety and risk mitigation."
Unified Solutions,"Financial reporting and consolidation automation. Multi-entity consolidation and reporting. GAAP and local accounting standards compliance. Variance analysis and explanations. Month-end close acceleration."
Enterprise Solutions,"Manufacturing production scheduling and optimization. Demand integration and forecasting. Shop floor scheduling and execution. Work-in-process optimization. On-time delivery improvement by 20%."
Integrated Framework,"Healthcare value-based care and outcomes measurement. Clinical outcome tracking and reporting. Cost-benefit analysis of treatments. Population health management. Improved quality and cost reduction."
Cloud Hub,"Retail employee training and onboarding. Digital learning modules and content. Skills assessment and tracking. Competency management. Training effectiveness and employee productivity."
Secure Services,"Insurance claims workflow and document management. Claims intake automation. Workflow routing and approval. Document repository and retrieval. Claims processing acceleration."
Quantum Framework,"Financial risk quantification and Value-at-Risk modeling. Market risk calculation across portfolios. Scenario analysis and stress testing. Regulatory capital calculation. Risk management and compliance."
Nexus Hub,"Entertainment social media and influencer marketing. Influencer identification and outreach. Campaign management and tracking. Engagement metrics and analytics. Content reach and audience growth."
Vertex Services,"Telecommunications network quality and performance management. Real-time performance monitoring. Service level agreement tracking. Automated remediation and alerts. Network quality and customer satisfaction."
Apex Analytics,"Legal research and knowledge management. Case law and statute database. Legal research automation. Knowledge base and best practices. Research efficiency and consistency."
Summit Solutions,"Sports event management and ticketing. Venue operations management. Parking and traffic optimization. Vendor and supplier coordination. Event experience optimization."
Advanced Hub,"Construction workforce planning and productivity tracking. Crew scheduling and time tracking. Productivity metrics and benchmarking. Safety training and certification. Labor productivity improvement."
Strategic Solutions,"Pharmaceutical market access and reimbursement strategy. Payor engagement and evidence development. Health economics analysis. Pricing and contract optimization. Market access acceleration."
Digital Engine,"Telecommunications service assurance and quality of experience. Call quality monitoring and analysis. Network performance correlation with customer experience. Automated remediation. Service quality and customer satisfaction."
Global Framework,"Automotive battery management and EV infrastructure. Battery health monitoring and diagnostics. Charging station location optimization. Grid integration management. EV adoption enablement."
Smart Analytics,"Hospital medical equipment management and maintenance. Equipment tracking and utilization. Preventive maintenance scheduling. Compliance with regulatory inspections. Equipment reliability and safety."
Unified Framework,"Financial investment portfolio management and reporting. Portfolio valuation and performance tracking. Asset allocation and rebalancing. Risk-adjusted return analysis. Client reporting and communications."
Enterprise Hub,"Manufacturing supplier quality and performance management. Supplier scorecard and metrics. Quality issue escalation and resolution. Supplier development and improvement. Supply chain quality assurance."
Integrated Analytics,"Healthcare prescription management and medication adherence. E-prescription integration with pharmacies. Medication reminders and tracking. Adherence monitoring and intervention. Patient outcomes improvement."
Cloud Solutions,"Retail gift card and loyalty points management. Real-time balance tracking and updates. Redemption processing and settlement. Promotional campaign integration. Revenue recognition and fraud prevention."
Secure Analytics,"Insurance investigation case management. Digital evidence management. Investigation workflow and tracking. Claim outcome tracking. Investigation efficiency and fraud prevention."
Quantum Hub,"Financial cash flow forecasting and liquidity planning. Daily cash position forecasting. Liquidity stress testing. Automated cash movement. Working capital optimization."
Nexus Framework,"Entertainment event production and live streaming. Multi-camera directing and switching. Real-time analytics and insights. Multi-platform distribution. Viewer engagement and reach."
Vertex Analytics,"Telecommunications tower and site management. Site operations and maintenance tracking. Tenant coordination and billing. Environmental and safety compliance. Site portfolio optimization."
Apex Hub,"Legal intellectual property management and protection. Patent portfolio management. Trademark monitoring and enforcement. Licensing and cross-licensing tracking. IP value protection and monetization."
Summit Analytics,"Sports stadium and venue operations. Facility maintenance and scheduling. Safety and security management. Concession and retail operations. Fan experience optimization."
Advanced Analytics,"Construction material procurement and inventory. Supply ordering and delivery tracking. Cost tracking and forecasting. Waste reduction and recovery. Procurement efficiency and cost control."
Strategic Hub,"Pharmaceutical sales and marketing effectiveness measurement. Campaign ROI tracking. Sales territory analytics. Competitive positioning analysis. Marketing investment optimization."
Digital Solutions,"Telecommunications 5G deployment and optimization. Network coverage planning and rollout. Performance monitoring and optimization. Customer experience in 5G networks. 5G capability enablement."
Global Services,"Automotive dealership operations and management. Sales and service scheduling. Customer relationship tracking. Inventory and parts management. Dealership profitability optimization."
Smart Services,"Hospital bed management and patient flow. Real-time bed availability and assignment. Patient transfer optimization. Discharge planning coordination. Hospital throughput improvement."
Unified Hub,"Financial loan origination and credit decisioning. Application intake and document collection. Credit risk assessment. Loan pricing optimization. Origination volume and efficiency improvement."
Enterprise Analytics,"Manufacturing production control and execution. Real-time production status tracking. Work order management and sequencing. Quality tracking and control. On-time, on-quality delivery."
Integrated Services,"Healthcare home health care coordination. Visit scheduling and routing. Patient assessment and plan tracking. Caregiver assignment optimization. Care quality and visit productivity."
Cloud Framework,"Retail price comparison and competitive intelligence. Market price monitoring. Competitor pricing and promotional tracking. Price elasticity analysis. Pricing strategy optimization."
Secure Hub,"Insurance policy servicing and administration. Policy change processing and systems updates. Billing and statement generation. Customer service issue tracking. Policy servicing efficiency."
Quantum Analytics,"Financial derivative pricing and valuation. Option pricing models. Bond and fixed income valuation. Exotic derivative pricing. Valuation accuracy and consistency."
Nexus Services,"Entertainment audience research and testing. Survey and focus group management. Content testing and optimization. Audience preference analysis. Content ROI optimization."
Vertex Solutions,"Telecommunications mobile device management. Device provisioning and activation. Remote configuration and updates. Security policy enforcement. Device fleet security and management."
Apex Framework,"Legal matter management and time tracking. Attorney time tracking and billing. Project management and status reporting. Client billing and collections. Matter profitability optimization."
Summit Hub,"Sports fan engagement and community building. Fan forums and discussion boards. Event information and updates. Merchandise and ticket sales. Community growth and loyalty."
