Project Name,Description
Advanced Framework,"Construction building information modeling. 3D project visualization and planning. Clash detection and coordination. Prefabrication optimization. Construction efficiency and quality."
Strategic Framework,"Pharmaceutical product lifecycle management. Product launch planning and execution. Market introduction and commercialization. Product retirement and closeout. Lifecycle ROI optimization."
Digital Analytics,"Telecommunications customer service and support. Multi-channel support availability. Self-service knowledge base. Support ticket tracking and resolution. Customer satisfaction improvement."
Global Solutions,"Automotive telematics and vehicle diagnostics. Remote vehicle monitoring and diagnostics. Maintenance alerts and scheduling. Driver behavior analysis. Vehicle reliability and safety."
Smart Hub,"Hospital pharmacy operations and medication management. Pharmacy inventory and supply chain. Medication dispensing and verification. Drug interaction checking. Medication safety and efficiency."
Unified Solutions,"Financial securities operations and settlement. Trade processing and confirmation. Settlement instruction processing. Cash management and reconciliation. Operational efficiency and risk reduction."
Enterprise Framework,"Manufacturing environmental and compliance management. Emissions tracking and reporting. Waste disposal and recycling. Environmental impact reduction initiatives. Regulatory compliance and sustainability."
Integrated Hub,"Healthcare clinical laboratory operations. Lab test order management. Sample tracking and testing. Result reporting and follow-up. Lab efficiency and test quality."
Cloud Analytics,"Retail visual merchandising and store design. Planogram management and compliance. Store layout optimization. Seasonal refresh planning. Sales uplift from merchandising optimization."
Secure Framework,"Insurance claims data analytics and insights. Claims cost trending. Fraud pattern detection. Customer insights from claims data. Claims analytics and prevention."
Quantum Solutions,"Financial securities lending and collateral management. Collateral valuation and haircut management. Lending arrangement tracking. Collateral movement and reconciliation. Risk mitigation and compliance."
Nexus Analytics,"Entertainment content metadata management. Show and movie catalog management. Rights and licensing tracking. Content recommendations. Content discovery improvement."
Vertex Framework,"Telecommunications infrastructure asset management. Network equipment inventory and tracking. Asset depreciation and lifecycle. Preventive maintenance scheduling. Asset utilization optimization."
Apex Solutions,"Legal contract management for HR and employment. Employment agreement tracking. Benefits and compensation contracts. Change of control monitoring. Contract compliance and risk mitigation."
Summit Framework,"Sports recruiting and player development. Player assessment and scouting. Development plan tracking. Performance monitoring. Talent development success."
Advanced Solutions,"Construction change order management and claims. Change request documentation. Impact analysis and pricing. Dispute resolution tracking. Claims management effectiveness."
Strategic Analytics,"Pharmaceutical quality by design and manufacturing. Process optimization studies. Quality risk assessment. Continuous improvement tracking. Manufacturing efficiency and quality."
Digital Framework,"Telecommunications content delivery optimization. Content caching and distribution. Bandwidth management. Quality of streaming optimization. User experience improvement."
Global Analytics,"Automotive manufacturing process optimization. Process metrics and KPIs. Continuous improvement initiatives. Root cause analysis. Efficiency and quality improvement."
Smart Framework,"Hospital laboratory information system. Lab data management and analysis. Quality control and calibration. Compliance with testing standards. Lab efficiency and accuracy."
Unified Analytics,"Financial investment operations and reconciliation. Portfolio and transaction reconciliation. Fee calculation and billing. NAV and valuation tracking. Operational accuracy and efficiency."
Enterprise Services,"Manufacturing data collection and analytics. Real-time production data capture. Equipment and process metrics. KPI dashboard and reporting. Operational visibility and improvement."
Integrated Solutions,"Healthcare clinical workflow optimization. Process documentation and improvement. Resource allocation optimization. Bottleneck identification and resolution. Clinical efficiency improvement."
Cloud Framework,"Retail omnichannel inventory and fulfillment. Inventory location optimization. Order allocation to fulfillment locations. Fulfillment method selection. Fulfillment cost and speed optimization."
Secure Solutions,"Insurance fraud investigation support tools. Network analysis of fraud schemes. Document analysis and timeline creation. Investigation collaboration tools. Investigation efficiency improvement."
Quantum Framework,"Financial post-trade risk management. Real-time risk monitoring and alerts. Regulatory capital optimization. Stress testing and scenario analysis. Risk mitigation and compliance."
Nexus Solutions,"Entertainment digital rights management. Content protection and licensing. Distribution channel management. Revenue tracking and optimization. IP protection and monetization."
Vertex Analytics,"Telecommunications radio access network optimization. Cell site optimization and tuning. Antenna and frequency optimization. Coverage and capacity improvement. Network performance optimization."
Apex Analytics,"Legal legal spend management and budget tracking. Outside counsel spending tracking. Alternative fee arrangements. Spend analytics and benchmarking. Legal cost control and ROI."
Summit Services,"Sports athlete injury prevention and rehabilitation. Injury risk assessment and monitoring. Rehabilitation program tracking. Return-to-play decision support. Injury reduction and athlete longevity."
Advanced Framework,"Construction project financial management. Budget development and tracking. Cash flow forecasting and management. Contractor payment processing. Financial controls and profitability."
Strategic Services,"Pharmaceutical adverse event tracking and reporting. Safety issue documentation. Regulatory reporting and deadlines. Risk mitigation and safety monitoring. Patient safety and regulatory compliance."
Digital Services,"Telecommunications infrastructure network inventory. Network asset tracking and mapping. Fiber and cable routing documentation. Capacity and availability tracking. Network planning and optimization."
Global Framework,"Automotive fleet management and telematics. Vehicle tracking and location services. Driver safety and behavior monitoring. Fuel consumption tracking. Fleet efficiency and cost reduction."
Smart Solutions,"Hospital emergency department workflow. Patient flow tracking. Bed and treatment area utilization. Provider schedule optimization. Wait time reduction and throughput."
Unified Framework,"Financial middle office operations. Position and cash tracking. Regulatory reporting and filing. Compliance monitoring and alerts. Operational efficiency and accuracy."
Enterprise Analytics,"Manufacturing work force planning and skill management. Skill inventory and gap analysis. Training plan development. Workforce scheduling. Productivity and retention improvement."
Integrated Framework,"Healthcare emergency room patient tracking. Arrival to discharge time tracking. Provider and equipment utilization. Patient outcome tracking. Emergency care efficiency and safety."
Cloud Services,"Retail space planning and design. Space utilization analysis. Category placement optimization. Traffic flow planning. Sales and customer experience optimization."
Secure Framework,"Insurance customer acquisition cost analysis. Marketing spend by channel. Customer lifetime value by source. ROI by campaign. Marketing efficiency improvement."
Quantum Services,"Financial benchmark and reporting analytics. Performance metrics and KPI reporting. Benchmark comparison and analysis. Regulatory reporting. Performance transparency and improvement."
Nexus Framework,"Entertainment broadcast and transmission. Live event transmission. Multiple platform distribution. Quality monitoring. Viewership and engagement measurement."
Vertex Services,"Telecommunications cybersecurity and network defense. Intrusion detection and prevention. DDoS mitigation. Threat intelligence and response. Network security posture improvement."
Apex Analytics,"Legal legal research platform and knowledge. Statute and case law database. Legal research tools and analytics. Practice area knowledge base. Research efficiency and quality."
Summit Analytics,"Sports arena and venue technology. Wi-Fi and connectivity. Security and access control. Fan experience technology. Attendee engagement and experience."
Advanced Hub,"Construction safety training and certification. Online training module delivery. Competency assessment and tracking. Certification management. Safety culture and training compliance."
Strategic Solutions,"Pharmaceutical manufacturing compliance and validation. Batch record management. Equipment maintenance and qualification. Quality assurance and testing. Regulatory compliance and product quality."
Digital Hub,"Telecommunications business support systems. Billing and provisioning. Customer management and support. Service catalogs and ordering. Operational efficiency improvement."
Global Analytics,"Automotive supply chain forecasting. Demand forecasting and planning. Supply planning optimization. Inventory optimization. Supply-demand alignment."
Smart Services,"Hospital intensive care unit optimization. Patient monitoring and alerts. Medication administration tracking. Care protocol compliance. Patient safety and outcomes."
Unified Services,"Financial investment committee and governance. Investment decision documentation. Approval and authorization workflow. Investment tracking and reporting. Governance and compliance."
Enterprise Hub,"Manufacturing supply chain integration. Supplier connectivity and data sharing. Order and shipment visibility. Quality and compliance tracking. Supply chain collaboration."
Integrated Analytics,"Healthcare patient discharge planning. Discharge order management. Follow-up appointment scheduling. Medication reconciliation. Post-acute care coordination."
Cloud Analytics,"Retail customer data privacy and compliance. CCPA and GDPR compliance. Customer consent management. Data retention and deletion. Privacy compliance and trust."
Secure Analytics,"Insurance reinsurance placement and management. Reinsurance treaty tracking. Claims notification and processing. Premium and billing management. Reinsurance management efficiency."
Quantum Framework,"Financial market data management and distribution. Real-time data feeds and distribution. Data validation and quality. Market snapshot and historical archive. Data availability and quality."
Nexus Analytics,"Entertainment virtual and augmented reality experiences. Immersive content creation. Interactive viewer experiences. Audience engagement measurement. Next-generation content experiences."
Vertex Framework,"Telecommunications private network and SD-WAN. Enterprise network connectivity. Network performance optimization. Security policy enforcement. Enterprise connectivity transformation."
Apex Services,"Legal dispute resolution and litigation. Case timeline and document management. Discovery automation and review. Expert witness coordination. Litigation efficiency and outcomes."
Summit Solutions,"Sports financial management and accounting. Revenue tracking and reporting. Expense management and controls. Payroll and benefits administration. Financial health and transparency."
Advanced Services,"Construction supply chain and material management. Supplier inventory management. On-site material tracking. Just-in-time delivery coordination. Supply efficiency and cost control."
Strategic Services,"Pharmaceutical post-market surveillance and safety. Adverse event monitoring and trending. Safety signal detection. Regulatory reporting. Patient safety monitoring."
Digital Analytics,"Telecommunications network automation and orchestration. Service provisioning automation. Network configuration management. Intent-based networking. Operational efficiency automation."
Global Hub,"Automotive parts and maintenance supply chain. Aftermarket parts distribution. Warranty claims processing. Service parts inventory. Aftermarket business optimization."
Smart Analytics,"Hospital surgical services and OR management. Operating room scheduling. Surgical equipment and supply management. Case documentation and coding. Surgical efficiency and outcomes."
Unified Hub,"Financial trade finance and working capital. Letter of credit processing. Trade finance document handling. Supplier financing programs. Working capital optimization."
Enterprise Solutions,"Manufacturing labor and workforce management. Time and attendance tracking. Labor scheduling. Training and development. Workforce productivity optimization."
Integrated Services,"Healthcare patient billing and accounts receivable. Patient account setup and eligibility. Bill generation and mailing. Collections and payment posting. Revenue cycle optimization."
Cloud Solutions,"Retail category management and merchandising. Category performance analytics. Assortment optimization. Pricing and promotion planning. Sales and margin optimization."
Secure Solutions,"Insurance claims reserves and case management. Reserve estimation and tracking. Case outcome prediction. Reserve trending and analysis. Claims management and profitability."
Quantum Hub,"Financial market structure and microstructure analysis. Trading volume and flow analysis. Market impact analysis. Execution optimization. Trading performance improvement."
Nexus Services,"Entertainment fan and customer relationship management. Fan database and profiling. Marketing campaign management. Ticket and merchandise sales. Fan engagement and lifetime value."
Vertex Solutions,"Telecommunications enterprise customer management. Account management and service delivery. Contract management and renewals. Service level agreements. Enterprise customer satisfaction."
Apex Framework,"Legal intellectual property strategy and planning. Patent prosecution strategy. Competitive landscape analysis. Freedom-to-operate analysis. IP strategy optimization."
Summit Framework,"Sports venue management and events operations. Event scheduling and planning. Vendor and contractor coordination. Safety and security protocols. Event success and safety."
Advanced Analytics,"Construction project planning and scheduling. CPM scheduling and optimization. Resource allocation and leveling. Progress tracking and reporting. Schedule performance."
Strategic Analytics,"Pharmaceutical manufacturing cost analysis. Cost by product and process. Variance analysis and investigation. Cost reduction initiatives. Manufacturing cost optimization."
Digital Solutions,"Telecommunications enterprise security. Corporate network security. Threat and vulnerability management. Security policy enforcement. Enterprise security posture."
Global Solutions,"Automotive quality and defect tracking. Defect documentation and root cause. Warranty and recall management. Quality improvements. Quality and customer satisfaction."
Smart Framework,"Hospital materials management and supply chain. Inventory management and optimization. Supply ordering and receiving. Vendor management. Supply chain efficiency and costs."
Unified Solutions,"Financial operational risk management and compliance. Risk identification and assessment. Control testing and validation. Compliance monitoring. Operational risk mitigation."
Enterprise Framework,"Manufacturing inventory management and optimization. Inventory forecasting and planning. Warehouse operations. Inventory accuracy and obsolescence. Inventory turnover and costs."
Integrated Framework,"Healthcare pharmacy benefit management. Formulary management and optimization. Prior authorization processing. Medication cost management. Drug cost and quality management."
Cloud Framework,"Retail customer loyalty and personalization. Loyalty program management. Personalized offers and recommendations. Customer engagement tracking. Loyalty growth and value."
Secure Framework,"Insurance regulatory compliance and reporting. Regulatory change management. Compliance documentation. Risk and solvency assessment. Regulatory compliance and reporting."
Quantum Analytics,"Financial market research and investment analytics. Equity and fixed income research. Investment opportunity analysis. Portfolio recommendations. Investment decision support."
Nexus Hub,"Entertainment music and audio streaming. Song catalog management. Licensing and royalty tracking. Artist and listener analytics. Music service optimization."
Vertex Services,"Telecommunications IoT platform and ecosystem. Sensor data collection and processing. Device management and provisioning. Real-world data monetization. IoT business model enablement."
Apex Hub,"Legal contract management for procurement. Purchase order and contract management. Compliance with contract terms. Supplier onboarding. Procurement efficiency and compliance."
Summit Hub,"Sports performance measurement and analytics. Athlete biometric tracking. Training effectiveness analytics. Competition prediction models. Performance optimization."
Advanced Solutions,"Construction project risk management. Risk identification and assessment. Insurance and surety management. Change order management. Risk mitigation."
Strategic Hub,"Pharmaceutical supply chain quality control. Raw material testing and approval. Batch sampling and testing. Final product testing. Supply quality assurance."
Digital Framework,"Telecommunications edge computing and MEC. Application deployment at network edge. Low-latency service delivery. 5G MEC enablement. Next-generation service delivery."
Global Framework,"Automotive connected services and data. Vehicle-generated data collection. Remote diagnostics and support. Over-the-air software updates. Connected vehicle services."
Smart Hub,"Hospital patient registration and master index. Patient demographic management. Duplicate record management. Master patient index. Patient data integrity."
Unified Analytics,"Financial credit risk assessment and monitoring. Credit scoring models. Default risk prediction. Portfolio risk analysis. Credit management optimization."
Enterprise Services,"Manufacturing maintenance spare parts planning. Spare parts demand forecasting. Inventory level optimization. Supply reliability. Spare parts availability and costs."
Integrated Analytics,"Healthcare medical coding and billing accuracy. Claim coding accuracy. Billing compliance audits. Revenue recovery. Billing accuracy and compliance."
Cloud Analytics,"Retail traffic analytics and store insights. Foot traffic measurement and analysis. Customer dwell time tracking. Conversion funnel analysis. Store performance optimization."
Secure Services,"Insurance premium audits and billing. Premium accuracy verification. Audit and adjustment processing. Customer billing. Premium accuracy and compliance."
Quantum Solutions,"Financial collateral management and optimization. Collateral valuation models. Haircut and risk management. Collateral movement tracking. Collateral efficiency."
Nexus Analytics,"Entertainment recommendation engines and personalization. User behavior tracking and analysis. Content recommendation algorithms. Engagement optimization. Content discovery and engagement."
Vertex Analytics,"Telecommunications network security and intrusion detection. Threat monitoring and alerting. Malware and intrusion prevention. Security incident response. Network security improvement."
Apex Solutions,"Legal e-discovery and document management. Document collection and preservation. Legal hold management. Evidence tracking. Discovery efficiency and compliance."
Summit Analytics,"Sports betting and fantasy sports. Sports data aggregation and analytics. Odds and prediction modeling. Betting platform operation. Fantasy sports platform operation."
Advanced Framework,"Construction building compliance and inspection. Code compliance tracking. Permit and license management. Inspection scheduling. Compliance assurance."
Strategic Framework,"Pharmaceutical development and clinical trial management. Protocol development and management. Patient enrollment and tracking. Data safety monitoring. Trial efficiency and quality."
Digital Analytics,"Telecommunications network visibility and monitoring. Real-time network performance tracking. Multi-layer network visibility. Service quality monitoring. Network operations optimization."
Global Services,"Automotive dealer inventory and sales. Vehicle inventory tracking. Sales contract and F&I management. Customer relationship tracking. Sales and inventory optimization."
Smart Solutions,"Hospital nursing and clinical staff scheduling. Shift scheduling and preference management. Float pool and agency management. Compliance with labor regulations. Staffing efficiency and satisfaction."
Unified Framework,"Financial customer due diligence and AML. Customer information collection. Risk profiling. Beneficial ownership verification. Compliance with AML regulations."
Enterprise Framework,"Manufacturing production execution and control. Shop floor operations management. Work order execution. Quality and compliance tracking. Production efficiency and quality."
Integrated Solutions,"Healthcare patient outcome measurement and reporting. Clinical outcome tracking. Quality metrics and reporting. Improvement initiatives tracking. Quality measurement and improvement."
Cloud Solutions,"Retail vendor management and procurement. Vendor onboarding and management. Purchase order and receiving. Vendor performance tracking. Procurement efficiency and vendor management."
Secure Services,"Insurance actuarial analysis and modeling. Actuarial valuations. Liability and reserve modeling. Pricing optimization. Actuarial analysis and accuracy."
Quantum Framework,"Financial risk analytics and stress testing. Portfolio risk measurement. Scenario and stress testing. VaR and risk metrics. Risk analytics and management."
Nexus Framework,"Entertainment content production and management. Video and audio production. Digital asset management. Rights and licensing tracking. Production efficiency and quality."
Vertex Hub,"Telecommunications IT service management. IT service delivery and support. Change and configuration management. IT cost management. IT operations efficiency."
Apex Analytics,"Legal billing and collections management. Attorney time and expense tracking. Client billing and invoicing. Collections and accounts receivable. Billing efficiency and collections."
Summit Services,"Sports stadium and arena safety. Security and access control. Emergency preparedness and response. Incident reporting and management. Safety assurance."
Advanced Analytics,"Construction contract administration and management. Contract milestone tracking. Payment processing and approval. Change order processing. Contract management efficiency."
Strategic Solutions,"Pharmaceutical formulation development. Formulation testing and optimization. Manufacturing process development. Stability testing. Development efficiency and quality."
Digital Services,"Telecommunications IT asset management. Software and hardware asset tracking. License management and compliance. Asset lifecycle management. IT cost control and compliance."
Global Analytics,"Automotive manufacturing quality assurance. In-process quality control. Final product inspection. Non-conformance tracking. Quality assurance and improvement."
Smart Analytics,"Hospital equipment maintenance and biomedical engineering. Equipment servicing and maintenance. Compliance with regulatory standards. Repair and replacement planning. Equipment reliability and safety."
Unified Solutions,"Financial accounting and financial reporting. General ledger and chart of accounts. Journal entry and posting. Financial statement preparation. Accounting accuracy and timeliness."
Enterprise Analytics,"Manufacturing capacity planning and optimization. Capacity forecasting and planning. Line and equipment optimization. Throughput maximization. Capacity utilization optimization."
Integrated Hub,"Healthcare care coordination and case management. High-risk patient identification. Care plan development and tracking. Provider and care team coordination. Care quality and outcomes."
Cloud Hub,"Retail shrinkage and inventory accuracy. Physical inventory management. Shrinkage investigation and prevention. Inventory reconciliation. Inventory accuracy improvement."
Secure Analytics,"Insurance competitor analysis and market intelligence. Competitor strategy tracking. Market trend analysis. Competitive positioning. Market intelligence and strategy."
Quantum Services,"Financial consolidated financial reporting. Multi-entity consolidation. GAAP and local GAAP reporting. Consolidation adjustments and eliminations. Consolidated reporting accuracy."
Nexus Services,"Entertainment content distribution and licensing. Digital rights and licensing management. Distribution channel management. Royalty tracking and payment. Content monetization optimization."
Vertex Analytics,"Telecommunications billing and customer care. Billing system and operations. Customer service and support. Billing issue resolution. Customer experience improvement."
Apex Framework,"Legal vendor management and external counsel. Outside counsel management. Vendor cost tracking. Contract and statement of work management. Vendor efficiency and cost control."
