Project Name,Description
Summit Analytics,"Sports athlete performance and development. Performance metrics and analytics. Training program effectiveness. Injury prevention and management. Athlete development success."
Advanced Hub,"Construction labor cost analysis and management. Labor hour tracking and analysis. Productivity metrics. Cost forecasting and management. Labor cost control."
Strategic Analytics,"Pharmaceutical supply chain security. Counterfeit detection and prevention. Supplier verification and auditing. Diversion prevention. Supply chain security."
Digital Hub,"Telecommunications customer order management. Order intake and processing. Service provisioning. Order tracking and delivery. Order fulfillment efficiency."
Global Hub,"Automotive logistics and distribution optimization. Logistics network optimization. Vehicle distribution and movement. Delivery scheduling. Logistics efficiency and costs."
Smart Analytics,"Hospital financial management and planning. Operational budgeting. Cost center management. Variance analysis. Financial management and control."
Unified Analytics,"Financial treasury operations and management. Cash and liquidity management. Foreign exchange management. Investment and borrowing. Treasury efficiency and returns."
Enterprise Analytics,"Manufacturing equipment and asset management. Equipment inventory and tracking. Maintenance and repairs. Depreciation and asset tracking. Asset management efficiency."
Integrated Analytics,"Healthcare clinical documentation and coding. Documentation quality assurance. Medical coding accuracy. Clinical performance metrics. Documentation quality and compliance."
Cloud Analytics,"Retail customer acquisition and retention. Customer lifetime value analysis. Retention program effectiveness. Churn prevention strategies. Acquisition and retention optimization."
Secure Analytics,"Insurance pricing and rate making. Rate development and approval. Underwriting criteria. Rate optimization. Pricing accuracy and competitiveness."
Quantum Analytics,"Financial treasury analytics and reporting. Cash position reporting. Liquidity analytics. Investment performance tracking. Treasury analytics and management."
Nexus Services,"Entertainment licensing and rights management. Content licensing agreements. Distribution rights tracking. Royalty agreements. Rights management optimization."
Vertex Services,"Telecommunications sales force management. Sales automation and tracking. Sales commission and incentive management. Pipeline management. Sales effectiveness improvement."
Apex Services,"Legal practice management and resource allocation. Attorney and staff utilization. Time allocation to practice areas. Resource forecasting. Practice efficiency optimization."
Summit Services,"Sports fan experience and engagement. Event experience measurement. Concessions and retail operations. Merchandise and souvenirs. Revenue optimization."
Advanced Services,"Construction project controls and reporting. Project status tracking. Schedule performance. Budget performance. Project control effectiveness."
Strategic Services,"Pharmaceutical market analysis and commercial planning. Market sizing and forecasting. Competitor analysis. Pricing strategy. Commercial success."
Digital Services,"Telecommunications network planning and design. Network demand forecasting. Network architecture planning. Technology selection. Network readiness."
Global Services,"Automotive after-sales service and support. Service scheduling and operations. Repair and maintenance operations. Warranty management. Service revenue optimization."
Smart Services,"Hospital governance and quality reporting. Quality metrics and tracking. Incident and adverse event reporting. Regulatory compliance reporting. Quality governance."
Unified Services,"Financial accounting controls and audit. Internal controls assessment. Control design and implementation. Audit trail and testing. Control environment effectiveness."
Enterprise Services,"Manufacturing production planning and control. Demand forecasting and planning. Master production scheduling. Supply planning coordination. Plan execution and achievement."
Integrated Services,"Healthcare information technology and systems. Electronic health record system. IT infrastructure and support. System security and compliance. IT reliability and performance."
Cloud Services,"Retail brand and product management. Product development and launch. Brand performance tracking. Product lifecycle management. Brand and product success."
Secure Services,"Insurance claims data quality and validation. Data accuracy and completeness. Claims adjudication accuracy. Audit and quality checks. Data quality assurance."
Quantum Services,"Financial derivatives trading and risk management. Trading strategy implementation. Risk management and hedging. Trade execution. Trading performance and risk."
Nexus Services,"Entertainment video and broadcast production. Studio and broadcast facilities. Production workflow and management. Broadcast scheduling and delivery. Production quality and efficiency."
Vertex Services,"Telecommunications fixed line and voice services. Service provisioning and management. Quality and service levels. Customer support and maintenance. Service delivery optimization."
Apex Services,"Legal transaction support and due diligence. M&A transaction documentation. Legal due diligence review. Closing coordination. Transaction efficiency and compliance."
Summit Services,"Sports team management and operations. Player contracts and negotiations. Team composition and strategy. Budget and financial management. Team performance and value."
Advanced Services,"Construction risk assessment and insurance. Construction risk identification. Insurance and bonding requirements. Claims management. Risk transfer and mitigation."
Strategic Services,"Pharmaceutical marketing and communications. Advertising and promotion. Medical education and support. Digital marketing. Marketing effectiveness and brand building."
Digital Services,"Telecommunications carrier and interconnection management. Carrier and service provider management. Interconnection agreements and billing. Regulatory compliance. Interconnection optimization."
Global Services,"Automotive finance and insurance operations. Vehicle financing and leasing. Insurance product integration. Customer relationship management. Finance and insurance optimization."
Smart Services,"Hospital information privacy and security. HIPAA compliance and security. Patient privacy protection. Breach notification and response. Privacy and security compliance."
Unified Services,"Financial forecasting and business planning. Financial forecasting. Budget planning and development. Scenario planning. Planning accuracy and effectiveness."
Enterprise Services,"Manufacturing industrial engineering and methods. Process design and improvement. Work standards development. Productivity improvement. Process efficiency."
Integrated Services,"Healthcare research and development. Clinical research support. Evidence generation. Publication and dissemination. Research productivity and quality."
Cloud Services,"Retail ecommerce and online operations. Online store operations. Digital marketing and optimization. Customer online experience. Online sales growth."
Secure Services,"Insurance regulatory capital and solvency. Solvency calculations. Capital requirement monitoring. Capital optimization. Regulatory compliance and efficiency."
Quantum Services,"Financial investment management and performance. Portfolio management and allocation. Performance measurement and attribution. Risk-adjusted performance. Investment management effectiveness."
Nexus Services,"Entertainment metadata and catalog management. Content organization and discovery. Rights and availability tracking. Audience analytics. Content discoverability."
Vertex Services,"Telecommunications directory and number management. Phone number management. Directory services. Number porting and management. Service continuity."
Apex Services,"Legal knowledge management and information systems. Practice area libraries. Document templates and precedents. Case and research tracking. Knowledge capture and reuse."
Summit Services,"Sports sponsorship and partnerships. Sponsorship opportunity development. Partner relationship management. Activation and ROI tracking. Partnership revenue and value."
Advanced Services,"Construction quality and safety management. Quality assurance and testing. Safety protocols and training. Incident and accident reporting. Quality and safety culture."
Strategic Services,"Pharmaceutical talent and organizational development. Recruitment and hiring. Employee development and training. Performance management. Organizational effectiveness."
Digital Services,"Telecommunications long-distance and international services. Service offerings and management. Pricing and rate management. Regulatory compliance. Service profitability."
Global Services,"Automotive technology and innovation. Advanced technology research. Electric and hybrid vehicle development. Autonomous vehicle development. Technology innovation leadership."
Smart Services,"Hospital patient experience and satisfaction. Patient satisfaction surveys. Experience improvement initiatives. Patient communication. Satisfaction and loyalty improvement."
Unified Services,"Financial internal audit and risk management. Risk assessment and monitoring. Control testing and evaluation. Management recommendations. Risk management effectiveness."
Enterprise Services,"Manufacturing continuous improvement and lean. Kaizen and improvement projects. Lean methodology implementation. Waste elimination. Efficiency and quality improvement."
Integrated Services,"Healthcare innovation and emerging technologies. Emerging technology evaluation. Technology pilot programs. New service development. Innovation and competitive advantage."
Cloud Services,"Retail supply chain visibility and collaboration. Supply chain network visualization. Supplier collaboration. Demand and supply visibility. Supply chain optimization."
Secure Services,"Insurance loss prevention and risk control. Risk control service delivery. Loss prevention consulting. Customer risk mitigation. Loss prevention effectiveness."
Quantum Services,"Financial transaction processing and settlement. Payment processing and clearing. Securities settlement. Regulatory compliance. Processing efficiency and accuracy."
Nexus Services,"Entertainment customer insights and analytics. Viewer behavior and preferences. Content performance analytics. Audience segmentation. Content and marketing optimization."
Vertex Services,"Telecommunications regulatory and government affairs. Regulatory tracking and compliance. Government relations. Industry association participation. Regulatory effectiveness."
Apex Services,"Legal corporate governance and compliance. Board governance and operations. Board meeting management. Regulatory compliance tracking. Governance effectiveness."
Summit Services,"Sports media and broadcasting. Sports broadcast rights. Media partnerships and sponsorships. Broadcast operations. Media revenue optimization."
Advanced Services,"Construction green building and sustainability. Sustainability certifications. Energy efficiency improvements. Sustainable materials use. Environmental responsibility."
Strategic Services,"Pharmaceutical quality assurance and testing. Quality control testing. Process validation. Stability testing. Quality excellence and compliance."
Digital Services,"Telecommunications data and broadband services. High-speed internet service. Data service offerings. Network reliability. Service quality and growth."
Global Services,"Automotive customer service and satisfaction. Customer service operations. Service quality and satisfaction. Customer feedback and improvement. Service excellence."
Smart Services,"Hospital clinical engineering and biomedical. Medical device management. Equipment quality and safety. Biomedical support. Equipment reliability and safety."
Unified Services,"Financial capital management and optimization. Capital planning and forecasting. Capital structure optimization. Capital raising and returns. Capital efficiency."
Enterprise Services,"Manufacturing sustainability and environmental management. Environmental compliance. Waste reduction and recycling. Energy efficiency. Sustainability and compliance."
Integrated Services,"Healthcare population health management. Risk stratification and targeting. Health promotion programs. Chronic disease management. Health outcomes and costs."
Cloud Services,"Retail revenue management and optimization. Pricing and promotion optimization. Markdown management. Product mix optimization. Revenue and margin optimization."
Secure Services,"Insurance asset and liability management. Financial asset management. Liability hedging and management. Investment portfolio management. Financial position optimization."
Quantum Services,"Financial market making and liquidity. Order book management. Bid-ask spread management. Liquidity provision. Market making profitability."
Nexus Services,"Entertainment global expansion and localization. International content strategy. Localization and dubbing. Regional partnerships. Global growth and expansion."
Vertex Services,"Telecommunications rural and underserved markets. Broadband expansion strategies. Rural service deployment. Community impact. Market expansion and accessibility."
Apex Services,"Legal alternative fee arrangements. Value-based pricing. Project-based pricing. Risk-sharing arrangements. Pricing efficiency and value."
Summit Services,"Sports event sponsorship and promotions. Sponsorship opportunities and packages. Event marketing and promotions. Sponsor relations. Sponsorship revenue."
Advanced Services,"Construction cost estimation and management. Project cost estimation. Cost forecasting and control. Change order pricing. Cost accuracy and control."
Strategic Services,"Pharmaceutical brand development and management. Brand strategy and positioning. Brand communication. Brand value and equity. Brand leadership and growth."
Digital Services,"Telecommunications smart city solutions. IoT connectivity and services. City infrastructure integration. Smart city applications. Next-generation city services."
Global Services,"Automotive sustainability and corporate responsibility. Emissions reduction. Sustainable sourcing. Community impact. ESG performance and reporting."
Smart Services,"Hospital physician engagement and satisfaction. Physician communication platforms. Medical staff services. Physician relationship management. Engagement and retention."
Unified Services,"Financial capital allocation and returns. Capital budgeting and approval. Capital project tracking. Return measurement. Capital efficiency and ROI."
Enterprise Services,"Manufacturing supply chain cost management. Supplier cost analysis. Cost reduction initiatives. Procurement optimization. Supply chain cost reduction."
Integrated Services,"Healthcare interoperability and data exchange. Health information exchange. System integration and interfaces. Data standardization. Interoperability and collaboration."
Cloud Services,"Retail assortment planning and management. Product assortment optimization. Assortment by location and channel. Inventory planning. Sales and profitability optimization."
Secure Services,"Insurance customer experience and journey mapping. Customer journey analysis. Touchpoint optimization. Experience improvement initiatives. Satisfaction and retention."
Quantum Services,"Financial trading systems and execution. Trading platform and systems. Order management systems. Execution quality. Trading efficiency and performance."
Nexus Services,"Entertainment creator and talent management. Talent recruitment and development. Contract and relationship management. Career development support. Talent success and growth."
Vertex Services,"Telecommunications wholesale and resale services. Wholesale offerings and pricing. Reseller support and enablement. Channel management. Wholesale revenue growth."
Apex Services,"Legal risk assessment and management. Legal risk identification. Risk mitigation planning. Insurance and indemnification. Legal risk reduction."
Summit Services,"Sports betting regulation and compliance. Regulatory compliance. Integrity and anti-fraud measures. Customer protection. Compliance and trust."
Advanced Services,"Construction// filepath: corporate_projects.csv
Project Name,Description
Advanced Platform,"This project aims to revolutionize our data processing capabilities by implementing cutting-edge machine learning algorithms. It will enable real-time analytics across all business units and provide actionable insights to stakeholders. The system will integrate seamlessly with existing infrastructure while maintaining backward compatibility. Expected ROI improvements of 35% within the first year of implementation. Project timeline spans 18 months with quarterly milestones."
Strategic Solutions,"A comprehensive initiative to modernize our legacy applications and migrate to cloud-native architectures. This transformation will reduce operational costs by 40% and improve system scalability dramatically. We will implement microservices patterns to enable independent deployment and faster feature releases. The project includes extensive team training and change management support. Completion target is Q4 2026 with phased rollout strategy."
Digital Infrastructure,"Enterprise-wide cybersecurity enhancement program designed to protect critical assets and comply with international regulations. Implementation of zero-trust architecture principles across all network segments and endpoints. Includes advanced threat detection, incident response automation, and continuous security monitoring. Multi-layered defense strategy with redundant systems for critical infrastructure protection. Estimated completion within 24 months with ongoing maintenance and updates."
Global Analytics,"Business intelligence consolidation effort to unify data from disparate systems into a single source of truth. Advanced visualization dashboards will empower decision-makers with real-time business metrics and KPIs. Implementation of ETL pipelines for automated data integration and quality assurance. Support for predictive analytics to forecast market trends and customer behavior. Expected to drive a 25% improvement in decision-making speed."
Smart Services,"Customer experience transformation initiative leveraging AI and personalization technologies across all touchpoints. Omnichannel integration enabling seamless interactions across web, mobile, and physical channels. Implementation of advanced chatbots and virtual assistants for 24/7 customer support. Data-driven approach to understand and anticipate customer needs proactively. Success metrics include 30% increase in customer satisfaction and retention rates."
Unified Framework,"Supply chain optimization program utilizing IoT sensors and blockchain technology for end-to-end visibility. Real-time tracking of inventory, shipments, and warehouse operations across global locations. Implementation of automated reordering systems to minimize stockouts and excess inventory. Predictive maintenance capabilities to reduce equipment downtime by 35%. Project duration of 20 months with full deployment across all distribution centers."
Enterprise Gateway,"Financial compliance and audit automation solution designed to streamline regulatory reporting processes. Automated controls framework ensuring adherence to SOX, GDPR, and other international standards. Real-time monitoring of financial transactions with anomaly detection capabilities. Centralized audit trail with comprehensive logging for regulatory investigations. Implementation expected to reduce compliance costs by 50% annually."
Integrated Suite,"Marketing automation and customer relationship management consolidation across all business units. Unified customer database enabling 360-degree view of all interactions and transactions. Personalized marketing campaigns driven by advanced segmentation and behavioral analytics. Integration with sales and customer service systems for seamless customer journey. Expected to increase marketing ROI by 45% and improve campaign effectiveness."
Cloud Hub,"Artificial intelligence and machine learning platform for enterprise-wide automation of repetitive tasks. Natural language processing capabilities for document analysis and classification at scale. Predictive models for demand forecasting, fraud detection, and risk assessment. Continuous learning systems that improve accuracy over time with minimal human intervention. Projected to save 10,000 hours annually across organization."
Secure Core,"Disaster recovery and business continuity modernization program protecting against all disruption scenarios. Geographically distributed data centers ensuring 99.999% uptime and zero data loss. Automated failover mechanisms with recovery time objective of less than 15 minutes. Comprehensive testing framework and disaster recovery drills conducted quarterly. Investment protects critical business operations and maintains customer trust."
Quantum Engine,"Product development lifecycle management system streamlining from ideation to market launch. Collaborative tools enabling cross-functional teams to work seamlessly across geographies. Resource allocation optimization ensuring efficient use of development and QA resources. Integrated tracking of requirements, development, testing, and deployment stages. Expected to reduce time-to-market by 30% and improve product quality metrics."
Nexus Portal,"Employee engagement and human resources transformation leveraging modern collaboration tools. Unified workplace platform consolidating communication, project management, and learning systems. AI-powered HR assistant providing instant answers to common employee questions. Performance management system with continuous feedback and development planning. Improved employee satisfaction scores by 40% and reduced attrition rates."
Vertex Network,"Customer loyalty and rewards program enhancement using gamific