Project Name,Description
Advanced Platform,"This project aims to revolutionize our data processing capabilities by implementing cutting-edge machine learning algorithms. It will enable real-time analytics across all business units and provide actionable insights to stakeholders. The system will integrate seamlessly with existing infrastructure while maintaining backward compatibility. Expected ROI improvements of 35% within the first year of implementation. Project timeline spans 18 months with quarterly milestones."
Strategic Solutions,"A comprehensive initiative to modernize our legacy applications and migrate to cloud-native architectures. This transformation will reduce operational costs by 40% and improve system scalability dramatically. We will implement microservices patterns to enable independent deployment and faster feature releases. The project includes extensive team training and change management support. Completion target is Q4 2026 with phased rollout strategy."
Digital Infrastructure,"Enterprise-wide cybersecurity enhancement program designed to protect critical assets and comply with international regulations. Implementation of zero-trust architecture principles across all network segments and endpoints. Includes advanced threat detection, incident response automation, and continuous security monitoring. Multi-layered defense strategy with redundant systems for critical infrastructure protection. Estimated completion within 24 months with ongoing maintenance and updates."
Global Analytics,"Business intelligence consolidation effort to unify data from disparate systems into a single source of truth. Advanced visualization dashboards will empower decision-makers with real-time business metrics and KPIs. Implementation of ETL pipelines for automated data integration and quality assurance. Support for predictive analytics to forecast market trends and customer behavior. Expected to drive a 25% improvement in decision-making speed."
Smart Services,"Customer experience transformation initiative leveraging AI and personalization technologies across all touchpoints. Omnichannel integration enabling seamless interactions across web, mobile, and physical channels. Implementation of advanced chatbots and virtual assistants for 24/7 customer support. Data-driven approach to understand and anticipate customer needs proactively. Success metrics include 30% increase in customer satisfaction and retention rates."
Unified Framework,"Supply chain optimization program utilizing IoT sensors and blockchain technology for end-to-end visibility. Real-time tracking of inventory, shipments, and warehouse operations across global locations. Implementation of automated reordering systems to minimize stockouts and excess inventory. Predictive maintenance capabilities to reduce equipment downtime by 35%. Project duration of 20 months with full deployment across all distribution centers."
Enterprise Gateway,"Financial compliance and audit automation solution designed to streamline regulatory reporting processes. Automated controls framework ensuring adherence to SOX, GDPR, and other international standards. Real-time monitoring of financial transactions with anomaly detection capabilities. Centralized audit trail with comprehensive logging for regulatory investigations. Implementation expected to reduce compliance costs by 50% annually."
Integrated Suite,"Marketing automation and customer relationship management consolidation across all business units. Unified customer database enabling 360-degree view of all interactions and transactions. Personalized marketing campaigns driven by advanced segmentation and behavioral analytics. Integration with sales and customer service systems for seamless customer journey. Expected to increase marketing ROI by 45% and improve campaign effectiveness."
Cloud Hub,"Artificial intelligence and machine learning platform for enterprise-wide automation of repetitive tasks. Natural language processing capabilities for document analysis and classification at scale. Predictive models for demand forecasting, fraud detection, and risk assessment. Continuous learning systems that improve accuracy over time with minimal human intervention. Projected to save 10,000 hours annually across organization."
Secure Core,"Disaster recovery and business continuity modernization program protecting against all disruption scenarios. Geographically distributed data centers ensuring 99.999% uptime and zero data loss. Automated failover mechanisms with recovery time objective of less than 15 minutes. Comprehensive testing framework and disaster recovery drills conducted quarterly. Investment protects critical business operations and maintains customer trust."
Quantum Engine,"Product development lifecycle management system streamlining from ideation to market launch. Collaborative tools enabling cross-functional teams to work seamlessly across geographies. Resource allocation optimization ensuring efficient use of development and QA resources. Integrated tracking of requirements, development, testing, and deployment stages. Expected to reduce time-to-market by 30% and improve product quality metrics."
Nexus Portal,"Employee engagement and human resources transformation leveraging modern collaboration tools. Unified workplace platform consolidating communication, project management, and learning systems. AI-powered HR assistant providing instant answers to common employee questions. Performance management system with continuous feedback and development planning. Improved employee satisfaction scores by 40% and reduced attrition rates."
Vertex Network,"Customer loyalty and rewards program enhancement using gamification and personalization techniques. Mobile-first platform enabling customers to earn, track, and redeem rewards seamlessly. Integration with POS systems for automatic points accumulation and real-time balance updates. Advanced analytics revealing customer preferences and optimizing reward offerings. Program expected to increase repeat purchase rates by 25% annually."
Apex Tower,"Procurement and vendor management consolidation creating a unified supplier ecosystem. Automated contract management with compliance tracking and renewal notifications. Real-time spend analysis and category management for cost optimization opportunities. Supplier performance dashboards enabling data-driven vendor selection decisions. Projected savings of $5M annually through process optimization and better negotiations."
Summit Catalyst,"Quality assurance and testing automation framework reducing manual effort and improving coverage. AI-powered test case generation and optimization minimizing redundant testing efforts. Continuous testing integration throughout development pipeline enabling faster feedback cycles. Automated regression testing ensuring stability across frequent releases. Reduction in post-release defects by 60% while accelerating release velocity."
Advanced Solutions,"Environmental sustainability and carbon footprint tracking across all operations and supply chain. Real-time monitoring of energy consumption, waste management, and emission sources. Automated reporting for sustainability goals and ESG compliance requirements. Identification of optimization opportunities for reducing environmental impact. Support for corporate sustainability commitments and stakeholder transparency."
Strategic Analytics,"Real estate portfolio optimization program for efficient space utilization and cost management. Smart building technology enabling remote management of HVAC, lighting, and security systems. Occupancy analytics revealing space utilization patterns and identifying consolidation opportunities. Integration with facilities management systems for preventive maintenance scheduling. Expected cost savings of 20% through improved operational efficiency."
Digital Services,"API economy and digital platform strategy enabling third-party integrations and ecosystem partnerships. Standardized interfaces and documentation enabling rapid integration of external services. Developer portal with comprehensive tools, SDKs, and support for partner onboarding. Monetization strategies for premium API access creating new revenue streams. Foundation for digital transformation and platform-based business models."
Global Framework,"Research and development innovation lab fostering breakthrough technologies and business models. Dedicated resources for experimentation with emerging technologies and market exploration. Collaboration with universities and startups for access to cutting-edge innovations. Portfolio approach balancing near-term improvements with long-term transformational initiatives. Expected to generate multiple new product lines within 3 years."
Smart Gateway,"Talent acquisition and recruitment marketing optimization using AI and data analytics. Automated candidate screening and matching against job requirements and team culture fit. Predictive analytics identifying candidates most likely to succeed and stay long-term. Recruitment marketing campaigns optimized for cost-per-hire and conversion rates. Reduction in time-to-fill by 40% and improved quality of new hires."
Unified Solutions,"Risk management and compliance framework consolidation across all business units and geographies. Integrated risk assessment processes identifying, measuring, and mitigating enterprise risks. Automated compliance monitoring ensuring adherence to all applicable regulations and policies. Centralized incident tracking and response enabling faster resolution and learning. Reduction in compliance violations and regulatory penalties by 75%."
Enterprise Analytics,"Social media and brand monitoring system tracking customer sentiment across all platforms. Real-time alerts for brand mentions, sentiment shifts, and emerging issues requiring response. Competitive intelligence gathering and analysis identifying market trends and opportunities. Influence tracking revealing key opinion leaders and amplification opportunities. Data-driven approach to social media strategy and crisis management."
Integrated Hub,"Logistics network optimization utilizing advanced analytics and transportation management systems. Route optimization algorithms reducing transportation costs and improving delivery performance. Warehouse location optimization based on demand patterns and cost analysis. Fleet management including vehicle tracking, maintenance, and driver performance monitoring. Expected reduction in logistics costs by 25% while improving delivery times."
Cloud Services,"Customer data platform unifying first-party data from all touchpoints and channels. Unified customer identifiers enabling accurate attribution and personalization across experiences. Privacy-compliant data management ensuring GDPR and CCPA compliance. Activation of customer data through APIs and pre-built integrations with marketing tools. Foundation for omnichannel marketing and improved customer experiences."
Secure Solutions,"Manufacturing execution system modernization enabling real-time production visibility and optimization. Integration with IoT devices and sensors capturing production metrics in real-time. Quality control automation using computer vision and AI for defect detection. Predictive maintenance preventing equipment failures and reducing unplanned downtime. Productivity improvements of 15% and quality enhancements across production lines."
Quantum Platform,"Healthcare data interoperability and patient information exchange across disparate systems. Standards-based FHIR APIs enabling secure sharing of patient records with authorized providers. Privacy controls ensuring patient consent and compliance with HIPAA requirements. Integration with clinical decision support systems for evidence-based care recommendations. Improved patient outcomes through better information access and care coordination."
Nexus Solutions,"Energy management and sustainability optimization for manufacturing and facilities operations. Real-time monitoring of energy consumption by equipment and production processes. AI-powered optimization algorithms identifying efficiency improvements and cost reduction opportunities. Demand response capabilities enabling participation in grid management programs. Reduction in energy costs by 30% while supporting sustainability goals."
Vertex Services,"Regulatory intelligence and change management platform tracking regulatory requirements across markets. Automated alerts and analysis of new regulations affecting business operations. Gap assessment identifying compliance gaps and remediation requirements. Centralized documentation and audit trails supporting regulatory examinations. Faster response to regulatory changes reducing compliance risk and costs."
Apex Solutions,"Insurance claims processing automation using AI and intelligent document processing. Automated claim validation, eligibility determination, and fraud detection. Straight-through processing for low-risk claims reducing manual touchpoints by 90%. Mobile app enabling customers to file and track claims on-the-go. Reduced claims processing time from weeks to days improving customer satisfaction."
Summit Framework,"Agricultural supply chain optimization for traceability and sustainable farming practices. Blockchain-based tracking from farm to consumer providing complete provenance. Real-time monitoring of growing conditions and optimization recommendations. Certification and compliance tracking for sustainable and organic farming standards. Direct consumer engagement through farm-to-table transparency and storytelling."
Advanced Hub,"Telecommunications network optimization utilizing machine learning and SDN technologies. Predictive network performance modeling preventing congestion and service degradation. Automated network configuration and resource allocation based on demand patterns. Integration with edge computing for reduced latency and improved user experiences. Network efficiency improvements reducing operational costs while enhancing service quality."
Strategic Platform,"Warehouse automation modernization leveraging robotics and intelligent inventory management. Automated picking, packing, and sorting systems reducing manual labor by 60%. Real-time inventory visibility enabling faster order fulfillment and reduced stockouts. Integration with warehouse management systems for optimized operations. Throughput increases of 40% while improving accuracy and reducing costs."
Digital Gateway,"Pension and retirement benefits administration modernization improving employee experience. Self-service portal enabling employees to view benefits, model scenarios, and make elections. Automated benefit calculations and compliance with regulatory requirements. Integration with payroll and HR systems for seamless administration. Reduced administrative costs by 35% while improving employee satisfaction."
Global Solutions,"Open banking and financial API strategy enabling fintech partnerships and new services. Standardized APIs exposing banking capabilities to third-party developers. Developer tools and sandbox environments accelerating integration and innovation. Revenue sharing models creating new business lines from API access. Competitive advantage through ecosystem and platform-based business model."
Smart Analytics,"Cybersecurity threat intelligence and incident response automation platform. Machine learning models detecting advanced threats and zero-day exploits. Automated response playbooks isolating compromised systems and preventing lateral movement. Integration with SIEM and endpoint protection systems for holistic visibility. Faster incident detection and response reducing breach impact by 80%."
Unified Gateway,"Enterprise resource planning modernization replacing legacy ERP with cloud-native solution. Migration of financial, HR, supply chain, and manufacturing modules to modern platform. Integrated data model eliminating data silos and improving operational visibility. Real-time reporting and analytics enabling faster, data-driven decision making. Reduced IT maintenance costs while improving system performance and reliability."
Enterprise Engine,"Pharmaceutical clinical trial optimization leveraging AI and real-world data analytics. Patient recruitment algorithms identifying and matching patients to appropriate trials. Predictive models reducing patient dropout rates and improving trial outcomes. Real-world evidence integration complementing traditional clinical trial data. Faster drug development cycles and improved success rates in regulatory approvals."
Integrated Services,"Fashion retail omnichannel experience unifying online, mobile, and physical store interactions. Unified inventory visibility enabling ship-from-store and flexible fulfillment options. Personal styling recommendations using AI and customer preference analysis. Virtual try-on capabilities using augmented reality technology. Improved customer experience driving higher conversion rates and customer lifetime value."
Cloud Platform,"Sports and entertainment fan engagement platform creating immersive interactive experiences. NFT and tokenization enabling fan ownership of digital collectibles and exclusive content. Gamification and loyalty rewards incentivizing fan participation and spending. Social features enabling fan communities and peer-to-peer interactions. New revenue streams from digital assets and premium experiences."
Secure Framework,"Aerospace supply chain visibility and quality management across global supplier network. Real-time tracking of parts and components throughout manufacturing and assembly. Quality and compliance documentation ensuring traceability for safety-critical components. Supplier performance analytics guiding improvement initiatives and risk mitigation. Enhanced safety and reduced delays in aircraft production and delivery."
Quantum Solutions,"Fashion supply chain sustainability tracking from raw materials through manufacturing. Sustainability metrics for water usage, chemical safety, and labor conditions. Certification and compliance verification ensuring ethical sourcing and manufacturing. Consumer transparency through product passports detailing sustainability attributes. Meeting consumer demand for responsible fashion while improving operational efficiency."
Nexus Framework,"Automotive manufacturing flexible production system enabling diverse model production on same line. Modular manufacturing approach enabling rapid changeover between models and variants. AI-powered production scheduling optimizing throughput and meeting demand. Quality control systems ensuring consistency across diverse product mix. Competitive advantage through manufacturing flexibility and reduced time-to-market."
Vertex Platform,"Financial advisory and wealth management personalization using AI and behavioral finance. Robo-advisor providing investment recommendations based on risk profile and goals. Human advisor collaboration tools enhancing productivity and client relationships. Behavioral coaching helping clients achieve financial goals despite emotional biases. Improved client outcomes and increased assets under management by 25%."
Apex Services,"Real estate technology platform enabling virtual property tours and remote transactions. 3D visualization and augmented reality enabling immersive property viewing. Digital transaction workflows reducing closing time from weeks to days. Blockchain-based title management ensuring secure and transparent ownership records. Disruption of real estate industry enabling broader market participation."
Summit Solutions,"Food and beverage supply chain optimization ensuring freshness and reducing waste. Real-time temperature and humidity monitoring throughout cold chain. Predictive spoilage analytics and dynamic pricing strategies minimizing waste. Traceability enabling rapid recall if safety issues emerge. Revenue protection through waste reduction and improved product quality."
Advanced Services,"Retail pricing optimization using AI and dynamic pricing strategies. Demand forecasting and elasticity analysis informing price point decisions. Competitive intelligence integration enabling responsive pricing strategies. Personalized pricing based on customer segments and willingness to pay. Revenue increases of 5-10% through optimized pricing and inventory management."
Strategic Engine,"Luxury goods authentication and anti-counterfeiting using blockchain and cryptography. Product registration and ownership tracking throughout supply chain and resale. Consumer verification tools ensuring authenticity and preventing fraud. Supply chain transparency building brand trust and premium positioning. Protection of brand equity and prevention of revenue loss from counterfeits."
Digital Platform,"Media and entertainment content recommendation engine using collaborative filtering. Personalized content discovery improving engagement and watch time. Multi-platform synchronization enabling seamless viewing across devices. Predictive analytics informing content production and acquisition decisions. Reduced churn and increased subscription value through better recommendations."
Global Engine,"Construction project management and safety coordination across distributed job sites. Real-time safety monitoring using IoT sensors and computer vision. Predictive safety analytics identifying hazards before accidents occur. Digital documentation and compliance tracking ensuring OSHA adherence. Reduced safety incidents and improved productivity through proactive management."
Smart Services,"Financial transaction monitoring and AML compliance automation preventing money laundering. Machine learning models detecting suspicious patterns and unusual activities. Automated reporting to regulatory authorities ensuring timely compliance. Customer risk profiling ensuring appropriate due diligence. Reduced false positives and improved analyst productivity by 50%."
Unified Hub,"Education learning management system modernization enabling personalized student experiences. Adaptive learning technology adjusting content difficulty based on student progress. AI tutoring providing personalized support and feedback to students. Learning analytics revealing at-risk students for early intervention. Improved student outcomes and reduced education equity gaps."
Enterprise Services,"Pharmaceutical sales force optimization using territory management and predictive analytics. Optimal territory assignment ensuring fair workload distribution and coverage. Activity recommendations prioritizing high-value customers and opportunities. Real-time coaching and performance analytics improving effectiveness. Sales productivity improvements of 15% and better customer relationships."
Integrated Gateway,"Legal document automation and contract management reducing attorney time on routine work. AI-powered contract analysis identifying key terms and potential risks. Automated document assembly based on templates and customer information. E-signature and workflow automation accelerating contract execution. Reduced legal costs and faster contracting enabling faster business velocity."
Cloud Solutions,"Retail inventory shrinkage reduction using computer vision and loss prevention analytics. Real-time shelf monitoring detecting out-of-stocks and misplaced inventory. Theft detection algorithms identifying suspicious activities and patterns. Inventory accuracy improvements reducing shrinkage by 40%. Improved inventory freshness and customer satisfaction through better stock levels."
Secure Services,"Insurance underwriting automation using AI and comprehensive risk assessment. Automated medical record review and analysis supporting underwriting decisions. Predictive models assessing applicant risk and determining appropriate pricing. Straight-through processing for low-risk applications accelerating decision time. Improved profitability through better risk selection and faster processing."
Quantum Framework,"Financial forecasting and cash flow optimization for improved treasury management. Predictive models forecasting revenue and expense trends. Automated cash positioning across accounts and entities optimizing returns. Liquidity risk monitoring and stress testing ensuring financial stability. Improved working capital efficiency and reduced financing costs by 15%."
Nexus Engine,"Hospitality guest experience personalization platform creating memorable stays. AI recommendations for dining, activities, and services based on preferences. Mobile app enabling frictionless interactions and requests throughout stay. Loyalty program personalization increasing repeat visits and spend. Competitive advantage through superior service and increased guest satisfaction."
Vertex Solutions,"Telecommunications customer churn prediction and retention campaign optimization. Predictive models identifying at-risk customers before they leave. Targeted retention offers and campaigns personalised to customer value and preferences. Win-back programs re-engaging previous customers and reinstating service. Reduced churn rates by 25% and improved customer lifetime value."
Apex Analytics,"Insurance claims fraud detection using advanced analytics and machine learning. Predictive models identifying high-fraud-risk claims for investigation. Network analysis detecting fraud rings and organized schemes. Real-time alerts enabling rapid investigation and prevention. Fraud loss reduction of 30% while maintaining customer satisfaction."
Summit Engine,"Retail workforce optimization and scheduling ensuring adequate staffing and payroll control. Demand forecasting optimizing labor scheduling to match customer traffic. Skills-based scheduling ensuring right skills available when needed. Labor cost control while maintaining service levels and employee satisfaction. Labor cost reduction of 10-15% improving operational profitability."
